Stärken,Schwächen
"Räumliche Potenziale: Rathaus, Park, Verkehrsknoten Südkreuz, Tourismus, weltoffen",Zweischneidige Entwicklung: Gentrifizierung und dauerhaft fehlender Platz für Neubauvorhaben
EUREF-Campus,Schlechte Ausstattung mit Kita-Plätzen
Zentrum der Stadtumbaukulisse Schöneberg-Südkreuz,Hohe Umweltbelastung durch Verkehr
"Beliebt, hohe Lagegunst (Indikator ist auch der steigende Anteil an Eigentumswohnungen)",
"Flächenpotenziale für sozial-kulturelle Projekte: z.B. ehemaliges Straßenbahndepot, Prälat Schöneberg, Hof Belziger Straße",
Gute Verkehrsanbindung,